{
  "$schema": "../eval-kit/schemas/eval-kit.config.schema.json",
  "schema_version": "eval-kit.config.v1",
  "suite_id": "technical-design",
  "suite_root": ".",
  "results_root": "results",
  "schema_roots": ["../eval-kit/schemas", "schemas"],
  "case_manifests": [
    "fixtures/cases/case-aerial-delivery-shipping-v1/case-manifest.json",
    "fixtures/cases/case-cloudevents-core-contract-v1/case-manifest.json",
    "fixtures/cases/case-customer-credit-order-saga-v1/case-manifest.json",
    "fixtures/cases/case-fineract-loan-lifecycle-v1/case-manifest.json",
    "fixtures/cases/case-kubernetes-sidecar-containers-v1/case-manifest.json",
    "fixtures/cases/case-openfeature-evaluation-api-v1/case-manifest.json",
    "fixtures/cases/case-tiny-laundry-pickup-v1/case-manifest.json"
  ],
  "artifact_roles": [
    "generation_visible",
    "grader_input",
    "semantic_reference",
    "maintainer_only",
    "provenance"
  ],
  "graders": {
    "technical-design-facts-boundaries": "src/adapters/technical-design/grader-adapter.mjs"
  },
  "reporters": {
    "technical-design-markdown": "src/adapters/technical-design/reporter.mjs"
  },
  "runner_defaults": {
    "case_manifest_schema_version": "technical-design.case-manifest.v1"
  }
}
